2021,6,MQ,Envoy Air,FCA,"Kalispell, MT: Glacier Park International",2,0,0,0,0,0,0,0,0,0,0,0,0,0,0
2021,6,MQ,Envoy Air,FNT,"Flint, MI: Bishop International",89,26,7.54,3.39,5.88,0,9.19,1,0,1540,387,145,349,0,659
2021,6,MQ,Envoy Air,FSD,"Sioux Falls, SD: Joe Foss Field",56,17,3.05,0.32,5.8,0,7.83,1,0,1442,139,38,402,0,863
2021,6,MQ,Envoy Air,FSM,"Fort Smith, AR: Fort Smith Regional",62,11,4.39,1.01,2.63,0,2.97,3,0,414,120,64,67,0,163
2021,6,MQ,Envoy Air,FWA,"Fort Wayne, IN: Fort Wayne International",27,5,0,0,2.12,0,2.88,0,0,204,0,0,58,0,146
2021,6,MQ,Envoy Air,GCK,"Garden City, KS: Garden City Regional",60,4,0.6,0.88,0.34,0,2.18,1,1,230,61,21,27,0,121
2021,6,MQ,Envoy Air,GGG,"Longview, TX: East Texas Regional",86,14,6.01,1.09,2.33,0,4.57,3,0,883,274,102,126,0,381
2021,6,MQ,Envoy Air,GJT,"Grand Junction, CO: Grand Junction Regional",170,27,5.85,1.92,7.77,0,11.45,1,0,1440,201,80,214,0,945
2021,6,MQ,Envoy Air,GPT,"Gulfport/Biloxi, MS: Gulfport-Biloxi International",90,15,2.37,1.38,3.97,0,7.29,2,0,628,100,59,226,0,243
2021,6,MQ,Envoy Air,GRB,"Green Bay, WI: Green Bay Austin Straubel International",86,27,8.61,2.25,3.35,0,12.79,2,1,2407,346,622,316,0,1123
2021,6,MQ,Envoy Air,GRI,"Grand Island, NE: Central Nebraska Regional",60,9,2.75,0,4,0,2.25,0,0,250,56,0,118,0,76
2021,6,MQ,Envoy Air,GRK,"Killeen, TX: Robert Gray AAF",182,35,10.06,4.45,4.61,0,15.89,3,2,2071,530,442,288,0,811
2021,6,MQ,Envoy Air,GRR,"Grand Rapids, MI: Gerald R. Ford International",117,36,11.31,1.76,13.3,0,9.62,2,1,2227,719,146,537,0,825
2021,6,MQ,Envoy Air,GSO,"Greensboro/High Point, NC: Piedmont Triad International",140,29,6.73,1.62,4.09,0,16.57,2,0,2120,337,159,258,0,1366
2021,6,MQ,Envoy Air,GSP,"Greer, SC: Greenville-Spartanburg International",91,26,6.91,1.61,7.24,0,10.25,2,0,1774,434,262,393,0,685
2021,6,MQ,Envoy Air,HHH,"Hilton Head, SC: Hilton Head Airport",28,5,0.14,0,4.86,0,0,0,1,182,3,0,179,0,0
2021,6,MQ,Envoy Air,HRL,"Harlingen/San Benito, TX: Valley International",56,14,2.9,0.67,5.78,0.16,4.49,0,0,893,225,146,225,3,294
2021,6,MQ,Envoy Air,HSV,"Huntsville, AL: Huntsville International-Carl T Jones Field",118,27,4.59,4.54,6.68,0,11.2,3,0,1886,223,558,431,0,674
2021,6,MQ,Envoy Air,IAD,"Washington, DC: Washington Dulles International",56,9,1.29,1.11,1.52,0,5.07,0,0,518,100,100,81,0,237
2021,6,MQ,Envoy Air,IAH,"Houston, TX: George Bush Intercontinental/Houston",46,18,2.51,1.42,9.85,0,4.23,0,0,1186,109,236,521,0,320
2021,6,MQ,Envoy Air,ICT,"Wichita, KS: Wichita Dwight D Eisenhower National",98,21,5.18,0.34,10.67,0,4.81,3,0,1191,338,10,561,0,282
2021,6,MQ,Envoy Air,ILM,"Wilmington, NC: Wilmington International",36,5,1.12,0,2.6,0,1.28,0,0,266,41,0,179,0,46
2021,6,MQ,Envoy Air,IND,"Indianapolis, IN: Indianapolis International",106,10,2.13,1.99,1.53,0,4.36,2,0,377,43,145,25,0,164
2021,6,MQ,Envoy Air,JAN,"Jackson/Vicksburg, MS: Jackson Medgar Wiley Evers International",146,30,8.72,3.12,7.02,0,11.14,3,0,1461,385,189,239,0,648
2021,6,MQ,Envoy Air,JAX,"Jacksonville, FL: Jacksonville International",171,55,11.33,7.18,14.6,0,21.9,4,0,3131,917,537,516,0,1161
2021,6,MQ,Envoy Air,LAN,"Lansing, MI: Capital Region International",60,17,5.8,3.4,2.49,0,5.31,1,0,1170,178,301,120,0,571
2021,6,MQ,Envoy Air,LAW,"Lawton/Fort Sill, OK: Lawton-Fort Sill Regional",92,14,5.69,0.29,3.08,0,4.94,3,0,688,216,16,99,0,357
2021,6,MQ,Envoy Air,LBB,"Lubbock, TX: Lubbock Preston Smith International",6,0,0,0,0,0,0,0,0,0,0,0,0,0,0
2021,6,MQ,Envoy Air,LCH,"Lake Charles, LA: Lake Charles Regional",90,12,2.36,1.12,2.35,0,6.16,2,0,783,68,122,83,0,510
2021,6,MQ,Envoy Air,LEX,"Lexington, KY: Blue Grass",114,18,7.06,0.91,5.25,0,4.78,4,0,1444,267,605,307,0,265
2021,6,MQ,Envoy Air,LFT,"Lafayette, LA: Lafayette Regional Paul Fournet Field",56,16,1.32,0.53,6.83,1,6.33,1,0,679,55,34,191,22,377
2021,6,MQ,Envoy Air,LGB,"Long Beach, CA: Long Beach Airport",34,2,0,0,1.21,0,0.79,0,0,135,0,0,112,0,23
2021,6,MQ,Envoy Air,LIT,"Little Rock, AR: Bill and Hillary Clinton Nat Adams Field",429,118,33.28,6.72,38.46,0,39.54,6,1,8016,1168,830,1724,0,4294
2021,6,MQ,Envoy Air,LRD,"Laredo, TX: Laredo International",63,10,2.93,0.56,2.73,0,3.78,1,0,456,121,42,86,0,207
2021,6,MQ,Envoy Air,LSE,"La Crosse, WI: La Crosse Regional",90,19,1.5,3.32,2.84,0,11.33,3,1,1976,105,1027,62,0,782
2021,6,MQ,Envoy Air,MAF,"Midland/Odessa, TX: Midland International Air and Space Port",30,3,1.23,0.13,0.34,0,1.3,0,0,277,72,18,31,0,156
2021,6,MQ,Envoy Air,MCI,"Kansas City, MO: Kansas City International",168,36,7.18,0.69,13.12,0,15.01,0,0,1856,363,73,406,0,1014
2021,6,MQ,Envoy Air,MDT,"Harrisburg, PA: Harrisburg International",4,0,0,0,0,0,0,0,0,0,0,0,0,0,0
2021,6,MQ,Envoy Air,MEM,"Memphis, TN: Memphis International",83,23,4.87,1.37,4.01,0,12.74,3,0,1204,236,135,180,0,653
2021,6,MQ,Envoy Air,MFE,"Mission/McAllen/Edinburg, TX: McAllen Miller International",28,9,1.74,0.05,2.36,0,4.85,0,0,493,49,13,67,0,364
2021,6,MQ,Envoy Air,MGM,"Montgomery, AL: Montgomery Regional",10,0,0,0,0,0,0,0,0,0,0,0,0,0,0
2021,6,MQ,Envoy Air,MHK,"Manhattan/Ft. Riley, KS: Manhattan Regional",58,10,1.73,3.01,0.94,0,4.32,0,0,1239,78,808,22,0,331
2021,6,MQ,Envoy Air,MIA,"Miami, FL: Miami International",1296,286,73.3,21.5,57.21,0.17,133.82,3,5,19658,4621,2243,2978,5,9811
2021,6,MQ,Envoy Air,MKE,"Milwaukee, WI: General Mitchell International",28,10,0.68,0.97,3.93,0,4.42,1,0,371,19,134,88,0,130
2021,6,MQ,Envoy Air,MLI,"Moline, IL: Quad City International",85,20,3.19,2.32,5.71,0,8.79,1,1,1113,116,171,274,0,552
2021,6,MQ,Envoy Air,MLU,"Monroe, LA: Monroe Regional",88,12,2.2,1.79,3.23,0,4.79,0,0,826,152,113,148,0,413
2021,6,MQ,Envoy Air,MOB,"Mobile, AL: Mobile Regional",36,6,1.49,0.87,1.6,0,2.03,0,0,496,77,115,79,0,225
2021,6,MQ,Envoy Air,MQT,"Marquette, MI: Sawyer International",55,18,5.23,1.68,4.57,0,6.52,0,0,1142,218,109,249,0,566
2021,6,MQ,Envoy Air,MRY,"Monterey, CA: Monterey Regional",60,17,6.22,1.47,2.6,0,6.72,0,0,897,247,130,148,0,372
2021,6,MQ,Envoy Air,MSN,"Madison, WI: Dane County Regional-Truax Field",147,31,6.38,3.07,8.78,0,12.77,4,1,1863,330,148,391,0,994
2021,6,MQ,Envoy Air,MSO,"Missoula, MT: Missoula International",60,4,2,1,0,0,1,0,0,114,42,19,0,0,53
2021,6,MQ,Envoy Air,MSP,"Minneapolis, MN: Minneapolis-St Paul International",88,24,3.29,2.65,5.58,0,12.48,1,1,1020,110,127,181,0,602
2021,6,MQ,Envoy Air,MSY,"New Orleans, LA: Louis Armstrong New Orleans International",58,12,4.09,0.26,3.69,0,3.95,0,0,877,306,20,194,0,357
2021,6,MQ,Envoy Air,MTJ,"Montrose/Delta, CO: Montrose Regional",2,0,0,0,0,0,0,0,0,0,0,0,0,0,0
2021,6,MQ,Envoy Air,MYR,"Myrtle Beach, SC: Myrtle Beach International",8,1,0,0,1,0,0,0,0,65,0,0,65,0,0
2021,6,MQ,Envoy Air,OKC,"Oklahoma City, OK: Will Rogers World",52,14,4.82,1.48,3.78,0,3.92,0,0,838,330,116,137,0,255
2021,6,MQ,Envoy Air,OMA,"Omaha, NE: Eppley Airfield",112,34,9.32,3.82,3.59,0,17.27,1,0,2579,382,268,106,0,1823
2021,6,MQ,Envoy Air,ORD,"Chicago, IL: Chicago O'Hare International",3986,827,154.2,88.51,280.95,1.12,302.22,75,22,74759,14972,9262,23370,75,27080
2021,6,MQ,Envoy Air,ORF,"Norfolk, VA: Norfolk International",68,13,5.61,1.01,1.2,0,5.17,0,1,553,118,121,28,0,286
2021,6,MQ,Envoy Air,PHX,"Phoenix, AZ: Phoenix Sky Harbor International",186,23,8.89,0,5.69,0,8.42,0,0,1327,712,0,147,0,468
2021,6,MQ,Envoy Air,PIA,"Peoria, IL: General Downing - Peoria International",88,15,2,1.79,2.65,0,8.56,1,0,967,56,137,144,0,630
2021,6,MQ,Envoy Air,PIT,"Pittsburgh, PA: Pittsburgh International",24,11,1.42,0.8,6.43,0,2.36,0,0,610,79,33,229,0,269
2021,6,MQ,Envoy Air,PNS,"Pensacola, FL: Pensacola International",98,37,6.25,2.05,18.11,0,10.59,1,0,2034,281,246,815,0,692
2021,6,MQ,Envoy Air,PVD,"Providence, RI: Theodore Francis Green State",30,4,1,0,1.46,0,1.54,0,0,154,29,0,44,0,81
2021,6,MQ,Envoy Air,PWM,"Portland, ME: Portland International Jetport",60,9,2.56,0.25,2.37,0,3.82,0,0,793,239,23,106,0,425
2021,6,MQ,Envoy Air,RDU,"Raleigh/Durham, NC: Raleigh-Durham International",109,27,3.58,2.12,10.16,0,11.15,0,0,2611,664,398,518,0,1031
2021,6,MQ,Envoy Air,ROC,"Rochester, NY: Greater Rochester International",28,9,0.75,2.92,1.95,0,3.38,0,0,678,46,268,89,0,275
2021,6,MQ,Envoy Air,RST,"Rochester, MN: Rochester International",90,15,3.01,2.39,0.99,0,8.61,2,1,928,172,101,57,0,598
2021,6,MQ,Envoy Air,SAV,"Savannah, GA: Savannah/Hilton Head International",62,23,1.99,1.92,10.97,0,8.11,0,0,1865,90,658,669,0,448
2021,6,MQ,Envoy Air,SBA,"Santa Barbara, CA: Santa Barbara Municipal",88,17,8.89,0,2.6,0,5.52,1,1,967,544,0,114,0,309
2021,6,MQ,Envoy Air,SBP,"San Luis Obispo, CA: San Luis County Regional",88,27,7.11,0.23,12.34,0,7.31,0,0,1169,317,9,395,0,448
2021,6,MQ,Envoy Air,SDF,"Louisville, KY: Louisville Muhammad Ali International",135,24,8.18,1.72,7.13,0,6.97,2,0,1506,382,170,210,0,744
2021,6,MQ,Envoy Air,SGF,"Springfield, MO: Springfield-Branson National",373,75,23.14,8.12,14.89,0,28.84,5,3,5343,1664,564,818,0,2297
2021,6,MQ,Envoy Air,SHV,"Shreveport, LA: Shreveport Regional",172,33,8.19,3.62,4.44,0,16.75,2,0,2205,237,563,238,0,1167
2021,6,MQ,Envoy Air,SJT,"San Angelo, TX: San Angelo Regional/Mathis Field",170,23,9.98,3.09,1.29,0,8.64,4,0,1543,407,333,56,0,747
2021,6,MQ,Envoy Air,SLC,"Salt Lake City, UT: Salt Lake City International",70,14,4.85,1.64,2.89,0,4.62,0,0,761,200,68,75,0,418
2021,6,MQ,Envoy Air,SPI,"Springfield, IL: Abraham Lincoln Capital",60,14,5.89,1.79,2.9,0,3.43,0,0,1182,790,139,126,0,127
2021,6,MQ,Envoy Air,SPS,"Wichita Falls, TX: Sheppard AFB/Wichita Falls Municipal",120,18,3.84,3.36,2.95,0,7.85,4,0,865,173,344,109,0,239
2021,6,MQ,Envoy Air,SRQ,"Sarasota/Bradenton, FL: Sarasota/Bradenton International",4,1,0.25,0,0.22,0,0.53,0,0,51,13,0,11,0,27
2021,6,MQ,Envoy Air,STL,"St. Louis, MO: St Louis Lambert International",34,6,0.98,1.33,3.29,0,0.4,0,0,360,49,138,109,0,64
2021,6,MQ,Envoy Air,STS,"Santa Rosa, CA: Charles M. Schulz - Sonoma County",60,9,5.12,0,1.84,0,2.05,0,0,421,154,0,206,0,61
2021,6,MQ,Envoy Air,SWO,"Stillwater, OK: Stillwater Regional",58,9,3.35,0.15,1.02,0,4.48,2,2,546,167,17,50,0,312
2021,6,MQ,Envoy Air,SYR,"Syracuse, NY: Syracuse Hancock International",2,0,0,0,0,0,0,0,0,0,0,0,0,0,0
2021,6,MQ,Envoy Air,TLH,"Tallahassee, FL: Tallahassee International",56,14,5.15,1.5,2.49,0,4.85,0,0,1144,297,154,109,0,584
2021,6,MQ,Envoy Air,TOL,"Toledo, OH: Toledo Express",24,2,0,0.9,0.1,0,1,2,0,157,0,57,6,0,94
2021,6,MQ,Envoy Air,TPA,"Tampa, FL: Tampa International",32,13,2.15,1.19,5.74,0,3.92,0,0,644,103,52,339,0,150
2021,6,MQ,Envoy Air,TUL,"Tulsa, OK: Tulsa International",62,14,1.62,0.22,3.9,1,7.27,1,0,798,79,48,112,38,521
2021,6,MQ,Envoy Air,TVC,"Traverse City, MI: Cherry Capital",102,26,2.58,1.52,10.65,1,10.25,1,0,1539,211,85,406,38,799
2021,6,MQ,Envoy Air,TXK,"Texarkana, AR: Texarkana Regional-Webb Field",90,9,3.54,0.82,1.61,0,3.03,2,0,1802,284,491,55,0,972
2021,6,MQ,Envoy Air,TYR,"Tyler, TX: Tyler Pounds Regional",112,12,4.99,0.28,1.81,0,4.92,5,0,721,296,14,60,0,351
2021,6,MQ,Envoy Air,TYS,"Knoxville, TN: McGhee Tyson",86,21,4.91,2.52,4.52,0,9.04,1,0,1505,247,265,314,0,679
2021,6,MQ,Envoy Air,VPS,"Valparaiso, FL: Eglin AFB Destin Fort Walton Beach",24,10,1.28,0.19,6.67,0,1.86,0,0,476,48,14,314,0,100
2021,6,MQ,Envoy Air,XNA,"Fayetteville, AR: Northwest Arkansas Regional",418,92,31.07,6.3,20.66,0,33.97,4,0,5646,1441,490,1062,0,2653
2021,6,NK,Spirit Air Lines,ACY,"Atlantic City, NJ: Atlantic City International",305,79,20.17,7.92,33.83,0.32,16.76,0,0,5466,983,799,2224,8,1452
2021,6,NK,Spirit Air Lines,ATL,"Atlanta, GA: Hartsfield-Jackson Atlanta International",711,136,31.27,13,56.25,1.23,34.25,6,1,8491,1851,862,2547,95,3136
2021,6,NK,Spirit Air Lines,AUS,"Austin, TX: Austin - Bergstrom International",167,20,7.34,2.99,7.27,0,2.4,2,0,837,301,153,291,0,92
2021,6,NK,Spirit Air Lines,BDL,"Hartford, CT: Bradley International",133,40,13.64,3.5,17.51,2,3.35,0,0,2250,717,344,898,52,239
2021,6,NK,Spirit Air Lines,BNA,"Nashville, TN: Nashville International",135,26,4.89,2.29,13.49,0.44,4.9,0,0,2119,466,281,710,53,609
2021,6,NK,Spirit Air Lines,BOS,"Boston, MA: Logan International",208,46,12.11,3.63,17.06,0.47,12.73,1,0,2957,599,252,1083,8,1015
2021,6,NK,Spirit Air Lines,BQN,"Aguadilla, PR: Rafael Hernandez",60,38,14.94,3.98,14.28,0.46,4.33,0,0,2767,691,1019,623,22,412
2021,6,NK,Spirit Air Lines,BUR,"Burbank, CA: Bob Hope",14,2,0,0.55,0.49,0,0.95,0,0,113,0,38,33,0,42
2021,6,NK,Spirit Air Lines,BWI,"Baltimore, MD: Baltimore/Washington International Thurgood Marshall",429,120,38.85,9.82,50.88,1.3,19.15,4,1,7419,2055,722,2707,31,1904
2021,6,NK,Spirit Air Lines,CAK,"Akron, OH: Akron-Canton Regional",29,3,0.23,0,1.84,0,0.93,0,0,382,34,0,99,0,249
2021,6,NK,Spirit Air Lines,CLE,"Cleveland, OH: Cleveland-Hopkins International",286,91,23.38,8.2,37.92,3.85,17.65,4,1,4367,1145,629,1365,139,1089
2021,6,NK,Spirit Air Lines,CLT,"Charlotte, NC: Charlotte Douglas International",49,18,4.97,2.57,6.11,0,4.36,1,0,1389,284,85,482,0,538
2021,6,NK,Spirit Air Lines,CMH,"Columbus, OH: John Glenn Columbus International",200,46,13.28,3.04,15.28,0.37,14.03,2,0,2940,980,87,838,7,1028
2021,6,NK,Spirit Air Lines,CRW,"Charleston/Dunbar, WV: Yeager",21,3,1.97,0.72,0.31,0,0,0,0,80,50,21,9,0,0
2021,6,NK,Spirit Air Lines,DEN,"Denver, CO: Denver International",269,69,8.31,3.65,37.43,0.06,19.54,2,3,5431,453,275,3216,2,1485
2021,6,NK,Spirit Air Lines,DFW,"Dallas/Fort Worth, TX: Dallas/Fort Worth International",566,166,38.65,15.11,58.63,2.03,51.57,4,1,12499,2417,1340,3423,74,5245
2021,6,NK,Spirit Air Lines,DTW,"Detroit, MI: Detroit Metro Wayne County",811,195,60.66,9.98,82.41,1.35,40.6,3,1,14774,3890,1091,4770,115,4908
2021,6,NK,Spirit Air Lines,EWR,"Newark, NJ: Newark Liberty International",371,104,19.98,10.19,48.09,2.32,23.43,1,0,6617,1115,697,3481,78,1246
2021,6,NK,Spirit Air Lines,FLL,"Fort Lauderdale, FL: Fort Lauderdale-Hollywood International",2154,622,100.5,24.16,340.67,8.77,147.9,13,16,41006,6574,1428,18920,364,13720
2021,6,NK,Spirit Air Lines,GSO,"Greensboro/High Point, NC: Piedmont Triad International",26,3,0,1.48,1.52,0,0,0,0,146,0,97,49,0,0
2021,6,NK,Spirit Air Lines,IAH,"Houston, TX: George Bush Intercontinental/Houston",567,174,37.52,8.29,80.84,3.01,44.34,3,1,12725,3251,1337,4666,143,3328
2021,6,NK,Spirit Air Lines,IND,"Indianapolis, IN: Indianapolis International",190,43,11.82,2.35,17.29,2.6,8.93,0,0,2068,683,172,664,141,408
2021,6,NK,Spirit Air Lines,LAS,"Las Vegas, NV: McCarran International",1284,223,60.31,9.55,77.33,1.36,74.45,6,1,15692,4054,654,4441,72,6471
2021,6,NK,Spirit Air Lines,LAX,"Los Angeles, CA: Los Angeles International",708,121,34.94,4.54,35.97,2.38,43.17,3,1,9219,2995,299,1990,72,3863
2021,6,NK,Spirit Air Lines,LBE,"Latrobe, PA: Arnold Palmer Regional",119,26,11.71,3.43,7.43,0,3.43,0,0,1316,668,159,300,0,189
2021,6,NK,Spirit Air Lines,LGA,"New York, NY: LaGuardia",315,63,15.59,4.79,31.74,0.99,9.89,5,2,4515,1047,464,2146,41,817
2021,6,NK,Spirit Air Lines,MCI,"Kansas City, MO: Kansas City International",214,44,13.4,2.61,18.51,1.02,8.46,1,1,2519,787,105,606,28,993
2021,6,NK,Spirit Air Lines,MCO,"Orlando, FL: Orlando International",1811,521,111.33,27.3,230.12,13.97,138.29,20,24,33068,6263,1937,12061,497,12310
2021,6,NK,Spirit Air Lines,MKE,"Milwaukee, WI: General Mitchell International",21,8,4.41,0,1.59,0,2,0,0,275,178,0,48,0,49
2021,6,NK,Spirit Air Lines,MSP,"Minneapolis, MN: Minneapolis-St Paul International",147,31,8.43,3.63,14.13,1.13,3.68,2,0,1500,312,132,634,44,378
2021,6,NK,Spirit Air Lines,MSY,"New Orleans, LA: Louis Armstrong New Orleans International",343,69,19.65,5.37,23.76,0,20.23,4,1,4893,768,295,2397,0,1433
2021,6,NK,Spirit Air Lines,MYR,"Myrtle Beach, SC: Myrtle Beach International",706,170,25.41,6.82,101.17,1.73,34.87,2,0,9628,1719,456,4906,76,2471
2021,6,NK,Spirit Air Lines,OAK,"Oakland, CA: Metropolitan Oakland International",133,17,5.97,1.15,9,0,0.88,1,0,1032,414,25,505,0,88
2021,6,NK,Spirit Air Lines,ORD,"Chicago, IL: Chicago O'Hare International",571,197,31.51,11.87,102.2,3.39,48.03,6,3,14721,1780,791,7071,125,4954
2021,6,NK,Spirit Air Lines,PBI,"West Palm Beach/Palm Beach, FL: Palm Beach International",21,8,0,0.33,2.24,0,5.43,0,0,397,0,21,128,0,248
2021,6,NK,Spirit Air Lines,PDX,"Portland, OR: Portland International",60,8,2.9,1,2.05,0,2.05,0,0,710,252,33,292,0,133
2021,6,NK,Spirit Air Lines,PHL,"Philadelphia, PA: Philadelphia International",309,111,28.9,7.38,54.68,2.04,18,2,1,7208,1791,396,3447,48,1526
2021,6,NK,Spirit Air Lines,PHX,"Phoenix, AZ: Phoenix Sky Harbor International",35,7,1.91,0.36,2.01,0,2.72,1,0,602,107,40,107,0,348
2021,6,NK,Spirit Air Lines,PIT,"Pittsburgh, PA: Pittsburgh International",198,57,15.29,8.97,19.64,0.14,12.96,2,0,4121,949,590,1132,9,1441
2021,6,NK,Spirit Air Lines,PNS,"Pensacola, FL: Pensacola International",96,14,4.19,0.98,4.7,0,4.14,1,0,1991,1067,291,223,0,410
2021,6,NK,Spirit Air Lines,RDU,"Raleigh/Durham, NC: Raleigh-Durham International",36,9,3,1.96,2.73,0.45,0.86,0,0,472,137,124,121,24,66
2021,6,NK,Spirit Air Lines,RIC,"Richmond, VA: Richmond International",50,10,1.17,1.62,4.93,0,2.29,0,0,665,79,175,353,0,58
2021,6,NK,Spirit Air Lines,RSW,"Fort Myers, FL: Southwest Florida International",254,37,4.78,2.55,16.54,0,13.13,1,0,2996,134,221,532,0,2109
2021,6,NK,Spirit Air Lines,SAN,"San Diego, CA: San Diego International",76,16,1.87,3.25,7.1,0,3.78,0,0,962,46,231,492,0,193
2021,6,NK,Spirit Air Lines,SDF,"Louisville, KY: Louisville Muhammad Ali International",128,33,11.65,2.21,8.27,0,10.87,0,0,1771,526,103,419,0,723
2021,6,NK,Spirit Air Lines,SEA,"Seattle, WA: Seattle/Tacoma International",49,6,2.23,0.33,3.44,0,0,0,0,279,205,6,68,0,0
2021,6,NK,Spirit Air Lines,SJU,"San Juan, PR: Luis Munoz Marin International",365,116,36.9,10.44,45.48,1.2,21.97,2,1,7434,2148,719,2039,53,2475
2021,6,NK,Spirit Air Lines,SMF,"Sacramento, CA: Sacramento International",71,10,2.29,0.85,4.87,0,1.99,0,0,518,70,47,132,0,269
2021,6,NK,Spirit Air Lines,SNA,"Santa Ana, CA: John Wayne Airport-Orange County",70,5,0.87,0.94,2.16,0,1.04,0,0,287,117,29,117,0,24
2021,6,NK,Spirit Air Lines,STL,"St. Louis, MO: St Louis Lambert International",140,18,5.89,0,7.5,0.43,4.18,0,0,878,207,0,252,9,410
2021,6,NK,Spirit Air Lines,STT,"Charlotte Amalie, VI: Cyril E King",77,13,4.46,2.05,4.72,1.02,0.74,0,3,879,377,65,234,66,137
2021,6,NK,Spirit Air Lines,STX,"Christiansted, VI: Henry E. Rohlsen",30,11,5.18,1,2.9,0,1.92,0,0,970,390,24,217,0,339
2021,6,NK,Spirit Air Lines,TPA,"Tampa, FL: Tampa International",470,105,21.72,3.17,46.31,0.53,33.26,0,5,6964,1175,189,2621,24,2955
2021,6,OH,PSA Airlines Inc.,ABE,"Allentown/Bethlehem/Easton, PA: Lehigh Valley International",90,18,6.47,1.32,5.57,0,4.64,0,0,697,220,156,121,0,200
2021,6,OH,PSA Airlines Inc.,AEX,"Alexandria, LA: Alexandria International",30,9,1.15,1.66,1.38,0,4.81,1,0,1516,91,173,63,0,1189
2021,6,OH,PSA Airlines Inc.,AGS,"Augusta, GA: Augusta Regional at Bush Field",64,7,1.34,1.71,2.02,0,1.92,0,0,214,29,63,58,0,64
2021,6,OH,PSA Airlines Inc.,ALB,"Albany, NY: Albany International",188,44,13.14,10.72,6.25,0,13.89,2,0,3581,642,1557,264,0,1118
2021,6,OH,PSA Airlines Inc.,ATL,"Atlanta, GA: Hartsfield-Jackson Atlanta International",91,13,5.22,0.29,5.4,0,2.09,0,0,707,294,27,277,0,109
2021,6,OH,PSA Airlines Inc.,AVL,"Asheville, NC: Asheville Regional",155,39,8,3.36,13.75,0,13.9,0,0,2094,342,336,588,0,828
2021,6,OH,PSA Airlines Inc.,AVP,"Scranton/Wilkes-Barre, PA: Wilkes Barre Scranton International",116,28,9.61,3.49,11.9,0,3,1,0,1181,410,257,378,0,136
2021,6,OH,PSA Airlines Inc.,BDL,"Hartford, CT: Bradley International",14,2,0.34,0,0.77,0,0.89,0,0,162,19,0,49,0,94
2021,6,OH,PSA Airlines Inc.,BGR,"Bangor, ME: Bangor International",182,35,11.31,3.52,10.37,0,9.8,1,0,2329,529,167,409,0,1224
2021,6,OH,PSA Airlines Inc.,BHM,"Birmingham, AL: Birmingham-Shuttlesworth International",231,79,18.32,3.79,38.98,0,17.91,3,1,4566,873,463,1683,0,1547
2021,6,OH,PSA Airlines Inc.,BNA,"Nashville, TN: Nashville International",102,8,3.08,0.19,3.81,0,0.92,0,0,516,187,15,154,0,160
2021,6,OH,PSA Airlines Inc.,BTR,"Baton Rouge, LA: Baton Rouge Metropolitan/Ryan Field",90,13,4.24,3.06,2.46,1,2.23,0,0,1126,589,263,63,58,153
2021,6,OH,PSA Airlines Inc.,BTV,"Burlington, VT: Burlington International",228,40,10.64,1.89,11.61,0,15.86,2,0,2510,742,131,570,0,1067
2021,6,OH,PSA Airlines Inc.,BUF,"Buffalo, NY: Buffalo Niagara International",8,1,0,0,1,0,0,0,0,157,0,0,157,0,0
2021,6,OH,PSA Airlines Inc.,BWI,"Baltimore, MD: Baltimore/Washington International Thurgood Marshall",30,1,0,0,1,0,0,0,0,20,0,0,20,0,0
2021,6,OH,PSA Airlines Inc.,CAE,"Columbia, SC: Columbia Metropolitan",121,22,4.25,4.57,5.66,0.28,7.24,1,0,1035,237,273,160,5,360
2021,6,OH,PSA Airlines Inc.,CAK,"Akron, OH: Akron-Canton Regional",178,39,9.31,5.48,9.35,0,14.86,2,0,2204,403,467,260,0,1074
2021,6,OH,PSA Airlines Inc.,CHA,"Chattanooga, TN: Lovell Field",118,32,6.88,1.18,8.39,0,15.55,1,0,1711,268,65,263,0,1115
2021,6,OH,PSA Airlines Inc.,CHO,"Charlottesville, VA: Charlottesville Albemarle",58,15,6.38,0.39,0.43,0,7.81,0,1,1721,236,15,9,0,1461
2021,6,OH,PSA Airlines Inc.,CHS,"Charleston, SC: Charleston AFB/International",219,40,7.91,2.07,20.38,0,9.64,1,2,2398,533,226,1044,0,595
2021,6,OH,PSA Airlines Inc.,CID,"Cedar Rapids/Iowa City, IA: The Eastern Iowa",60,15,3.86,1.13,1.91,0,8.11,1,0,1225,239,18,68,0,900
2021,6,OH,PSA Airlines Inc.,CLE,"Cleveland, OH: Cleveland-Hopkins International",86,6,1.31,0.2,2.6,0,1.89,0,0,214,41,10,82,0,81
2021,6,OH,PSA Airlines Inc.,CLT,"Charlotte, NC: Charlotte Douglas International",6885,1114,273.57,71.54,289.4,5.57,473.92,52,18,91001,30078,6457,13628,292,40546
2021,6,OH,PSA Airlines Inc.,CMH,"Columbus, OH: John Glenn Columbus International",61,12,3.59,2.17,3.35,0,2.88,1,0,534,162,117,102,0,153
2021,6,OH,PSA Airlines Inc.,CRW,"Charleston/Dunbar, WV: Yeager",162,44,15.01,1.67,13.23,0,14.09,1,1,3106,852,115,678,0,1461
2021,6,OH,PSA Airlines Inc.,CVG,"Cincinnati, OH: Cincinnati/Northern Kentucky International",180,53,17.38,5.53,16.13,0,13.96,0,1,4780,1135,590,822,0,2233
2021,6,OH,PSA Airlines Inc.,DAB,"Daytona Beach, FL: Daytona Beach International",176,31,8.66,3.11,8.78,0.85,9.6,1,0,1647,530,167,309,56,585
2021,6,OH,PSA Airlines Inc.,DAY,"Dayton, OH: James M Cox/Dayton International",244,57,12.33,7.32,15.61,0.07,21.68,1,1,4260,843,783,744,2,1888
2021,6,OH,PSA Airlines Inc.,DCA,"Washington, DC: Ronald Reagan Washington National",1344,234,57.45,12.98,65.05,2.36,96.15,9,3,16396,5276,886,2879,128,7227
2021,6,OH,PSA Airlines Inc.,DFW,"Dallas/Fort Worth, TX: Dallas/Fort Worth International",120,24,6.2,2.56,7.45,0,7.8,4,1,2048,841,281,305,0,621
2021,6,OH,PSA Airlines Inc.,DSM,"Des Moines, IA: Des Moines International",50,9,3.96,0,4.02,0,1.03,1,0,1268,908,0,145,0,215
2021,6,OH,PSA Airlines Inc.,DTW,"Detroit, MI: Detroit Metro Wayne County",52,10,6.15,0.93,1.56,0.02,1.33,1,1,900,430,199,51,5,215
2021,6,OH,PSA Airlines Inc.,ECP,"Panama City, FL: Northwest Florida Beaches International",206,50,10.45,3.57,28.13,0.13,7.73,0,1,2102,555,182,760,5,600
2021,6,OH,PSA Airlines Inc.,ERI,"Erie, PA: Erie International/Tom Ridge Field",60,15,5.96,3.39,0.48,0,5.18,0,0,720,310,145,19,0,246
2021,6,OH,PSA Airlines Inc.,EWN,"New Bern/Morehead/Beaufort, NC: Coastal Carolina Regional",142,27,10.08,6.68,3.3,0,6.94,1,0,1574,461,356,108,0,649
2021,6,OH,PSA Airlines Inc.,FAY,"Fayetteville, NC: Fayetteville Regional/Grannis Field",175,41,13.37,5.71,10.83,0,11.08,1,0,2738,1216,375,325,0,822
2021,6,OH,PSA Airlines Inc.,FNT,"Flint, MI: Bishop International",90,24,6.47,3.44,10.77,0.9,2.42,0,1,1308,317,350,356,19,266
2021,6,OH,PSA Airlines Inc.,FSD,"Sioux Falls, SD: Joe Foss Field",60,14,2.57,1,4.93,0,5.49,1,0,598,77,53,157,0,311
2021,6,OH,PSA Airlines Inc.,FWA,"Fort Wayne, IN: Fort Wayne International",60,12,3.94,0,5.38,0,2.68,1,0,492,126,0,156,0,210
2021,6,OH,PSA Airlines Inc.,GNV,"Gainesville, FL: Gainesville Regional",119,20,4.98,1.77,8.39,0,4.85,1,1,1302,385,99,412,0,406
2021,6,OH,PSA Airlines Inc.,GPT,"Gulfport/Biloxi, MS: Gulfport-Biloxi International",62,16,3.57,1.21,6.57,0.1,4.56,0,0,1098,221,45,169,2,661
2021,6,OH,PSA Airlines Inc.,GRR,"Grand Rapids, MI: Gerald R. Ford International",72,20,5.71,0.83,8.5,0,4.95,1,0,1948,414,128,464,0,942
2021,6,OH,PSA Airlines Inc.,GSO,"Greensboro/High Point, NC: Piedmont Triad International",214,41,11.85,4.9,12.36,0,11.89,4,1,2380,509,431,473,0,967
2021,6,OH,PSA Airlines Inc.,GSP,"Greer, SC: Greenville-Spartanburg International",245,62,14.44,4.85,25.97,0,16.74,2,0,4020,794,514,1197,0,1515
2021,6,OH,PSA Airlines Inc.,HPN,"White Plains, NY: Westchester County",134,29,9.23,3.17,10.37,0,6.24,1,1,1305,393,291,282,0,339
2021,6,OH,PSA Airlines Inc.,HSV,"Huntsville, AL: Huntsville International-Carl T Jones Field",170,39,12.01,2.03,10.08,1,13.87,1,0,2226,763,144,274,33,1012
2021,6,OH,PSA Airlines Inc.,IAD,"Washington, DC: Washington Dulles International",145,36,10.78,4.67,10.4,0,10.14,2,0,1769,474,253,517,0,525
2021,6,OH,PSA Airlines Inc.,ILM,"Wilmington, NC: Wilmington International",196,30,12.31,2,9.83,0,5.86,1,0,1371,453,214,353,0,351
2021,6,OH,PSA Airlines Inc.,IND,"Indianapolis, IN: Indianapolis International",64,10,5.04,0,3.91,0,1.05,0,0,665,319,0,160,0,186
2021,6,OH,PSA Airlines Inc.,JAN,"Jackson/Vicksburg, MS: Jackson Medgar Wiley Evers International",149,31,7.47,4.88,10.39,0.22,8.04,3,0,1548,302,353,412,7,474
2021,6,OH,PSA Airlines Inc.,JAX,"Jacksonville, FL: Jacksonville International",148,24,7.56,0,10.24,1.09,5.11,0,1,1026,284,0,327,28,387
2021,6,OH,PSA Airlines Inc.,LAN,"Lansing, MI: Capital Region International",26,9,1.5,0,4.81,0,2.7,0,0,400,53,0,158,0,189
2021,6,OH,PSA Airlines Inc.,LEX,"Lexington, KY: Blue Grass",66,13,4.99,0.96,2.76,0,4.3,1,0,996,216,22,77,0,681
2021,6,OH,PSA Airlines Inc.,LFT,"Lafayette, LA: Lafayette Regional Paul Fournet Field",60,11,0.57,0.95,3.15,0,6.33,0,2,790,35,40,77,0,638
2021,6,OH,PSA Airlines Inc.,LIT,"Little Rock, AR: Bill and Hillary Clinton Nat Adams Field",58,25,7.01,1.41,13.08,0,3.5,0,0,1959,1225,80,502,0,152
2021,6,OH,PSA Airlines Inc.,MCI,"Kansas City, MO: Kansas City International",32,8,2.4,0,3.47,0,2.13,0,0,234,51,0,64,0,119
